{
  "id": "program_pgcert_clinical_trichology_hair_restoration_medicine",
  "streamSlug": "doctors",
  "slug": "postgraduate-certificate-clinical-trichology-hair-restoration-medicine",
  "title": "Postgraduate Certificate in Clinical Trichology and Hair Restoration Medicine",
  "workingTitle": "Postgraduate Certificate in Clinical Trichology and Hair Restoration Medicine",
  "awardType": "postgraduate-certificate",
  "status": "draft",
  "overview": "Structured doctor education in clinical trichology, diagnostic reasoning, therapeutics, and surgical foundations within an academic IIOHR framework.",
  "whoItsFor": [
    "Doctors entering or advancing in hair restoration medicine",
    "Physicians seeking structured clinical trichology education",
    "Surgeons requiring evidence-led academic grounding"
  ],
  "whyItMatters": [
    "Creates a consistent standards-led route into the specialty",
    "Supports safer clinical reasoning and case selection",
    "Links academic training to faculty oversight and certification"
  ],
  "deliveryModel": [
    "Online structured curriculum",
    "Faculty-reviewed assessment",
    "Progression-led certification pathway"
  ],
  "certificationSummary": [
    "Certificate eligibility requires completion of required modules and assessments",
    "Faculty review remains part of final certification governance"
  ],
  "clinicLicensingSummary": [
    "Doctor stream is designed to sit within wider clinic and faculty ecosystems",
    "Future clinic-facing reporting can be layered onto the shared academy core"
  ],
  "faqSummary": [
    "Program routes remain separate from consultant education",
    "Curriculum remains clinically and academically framed"
  ],
  "applyCta": {
    "href": "/apply",
    "label": "Apply for Doctor Training"
  },
  "duration": {
    "deliveryWindowMonths": null,
    "estimatedStudyHours": null,
    "pacingModel": "cohort-flexible postgraduate online delivery"
  },
  "levelIds": ["level_doctors_postgraduate_certificate"],
  "sectionIds": [
    "section_doctors_volume_1",
    "section_doctors_volume_2",
    "section_doctors_volume_3",
    "section_doctors_volume_4",
    "section_doctors_volume_5"
  ],
  "moduleIds": [],
  "competencyIds": [
    "doctors_vol1_comp_introduction_scope",
    "doctors_vol1_comp_follicle_biology",
    "doctors_vol1_comp_molecular_hormonal",
    "doctors_vol1_comp_consultation_history",
    "doctors_vol2_comp_clinical_examination",
    "doctors_vol2_comp_trichoscopy",
    "doctors_vol2_comp_investigations_biopsy",
    "doctors_vol2_comp_male_aga",
    "doctors_vol2_comp_female_pattern",
    "doctors_vol3_comp_telogen_diffuse_shedding",
    "doctors_vol3_comp_alopecia_areata",
    "doctors_vol3_comp_shaft_breakage",
    "doctors_vol3_comp_cicatricial_principles",
    "doctors_vol3_comp_lymphocytic_cicatricial",
    "doctors_vol3_comp_neutrophilic_cicatricial",
    "doctors_vol3_comp_scalp_inflammatory_infectious",
    "doctors_vol4_comp_medical_management",
    "doctors_vol4_comp_nutritional_lifestyle_support",
    "doctors_vol4_comp_regenerative_medicine",
    "doctors_vol4_comp_hair_transplantation",
    "doctors_vol4_comp_advanced_fue_science",
    "doctors_vol5_comp_long_hair_fue_unshaven",
    "doctors_vol5_comp_partial_transection_regenerative_donor",
    "doctors_vol5_comp_recovery_optimisation_complications",
    "doctors_vol5_comp_consultation_ethics_psychological_care",
    "doctors_vol5_comp_research_literacy_evidence_appraisal",
    "doctors_vol5_comp_capstone_clinical_integration",
    "doctors_vol5_comp_final_assessment_certification"
  ],
  "complianceNoticeIds": [
    "notice_doctors_medical_scope",
    "notice_doctors_surgical_training"
  ]
}
